ID,出典,問題文,正解,誤答1,誤答2,誤答3,意味・分類タグ,文意訳（ヒント）,解説,,,,,,,,,,,,,,,,
405,2023-3,...answers to the questions that customers ask most ( ).,frequently,directly,severely,probably,副詞・頻繁に,...顧客が最も頻繁に尋ねる質問への回答。,【正解のポイント】よくある質問（FAQ）。frequently（頻繁に）。【紛らわしい選択肢】severely（厳しく）。,,,,,,,,,,,,,,,,
406,2023-3,He will try to sleep ... so that he will not be tired when he reaches his ( ).,destination,celebration,reservation,generation,名詞・目的地,彼は目的地に着いたときに疲れていないように、飛行機で寝ようとします。,【正解のポイント】到着する場所。destination（目的地）。destiny（運命）と同語源。【紛らわしい選択肢】reservation（予約）。,,,,,,,,,,,,,,,,
407,2023-3,The law in this country does not ( ) drivers to cross railway tracks without stopping first.,permit,deserve,announce,operate,動詞・許可する,この国の法律は、運転手が一旦停止せずに踏切を渡ることを許可していません。,【正解のポイント】許す。permit（許可する）。allowの堅い語。【紛らわしい選択肢】deserve（～に値する）は準1級頻出。,,,,,,,,,,,,,,,,
408,2023-3,He follows the same ( ) each day.,routine,despair,exchange,minority,名詞・日課,彼は毎日同じ日課（ルーティン）に従っています。,【正解のポイント】決まった手順。routine（日課）。【紛らわしい選択肢】despair（絶望）、minority（少数派）。,,,,,,,,,,,,,,,,
409,2023-3,"Angela caught a cold, so she could not ( ) the school singing contest this year.",participate in,rely on,bump into,turn off,句動詞・参加する,アンジェラは風邪を引いたので、今年の合唱コンクールに参加できませんでした。,【正解のポイント】take part inと同義。participate in（～に参加する）。【紛らわしい選択肢】bump into（ばったり出会う/ぶつかる）。,,,,,,,,,,,,,,,,
410,2023-3,Can I think it ( ) and let you know tomorrow?,over,along,down,around,句動詞・熟考する,よく考えて（検討して）、明日知らせてもいいですか？,【正解のポイント】think over（じっくり考える、検討する）。consider。【紛らわしい選択肢】think ... downなどは熟語として不成立。,,,,,,,,,,,,,,,,
411,2023-3,I think we should ( ) books completely and learn everything from computers.,do away with,go on about,look forward to,come out of,句動詞・廃止する,本を完全に廃止して、すべてコンピュータから学ぶべきだと思います。,【正解のポイント】なくす。do away with（廃止する）。2017年から頻出の最重要熟語です。【紛らわしい選択肢】go on about（～について話し続ける）。,,,,,,,,,,,,,,,,
412,2023-3,"...but ( ), I think it’s pretty good.",by and large,back and forth,touch and go,give and take,熟語・概して,...でも、概して（全体的には）、かなり良いと思います。,【正解のポイント】総じて。by and large（概して）。on the wholeと同義。【紛らわしい選択肢】back and forth（行ったり来たり）、touch and go（際どい状況）。,,,,,,,,,,,,,,,,
413,2023-3,"Keep trying, Billy, and ( ), your luck will change.",one of these days,at the moment,at a distance,one after another,熟語・そのうち,頑張り続けなさい、ビリー。そうすればそのうち（近いうちに）、運が向いてくるわ。,【正解のポイント】未来のいつか。one of these days（近いうちに、そのうち）。someday。【紛らわしい選択肢】at the moment（現在）。,,,,,,,,,,,,,,,,
414,2023-3,I’m ( ) all the rain we’ve been getting lately.,fed up with,gone out for,made out of,wrapped up in,熟語・うんざり,最近の雨続きにはうんざりだよ。,【正解のポイント】be fed up with（～にうんざりしている）。sick ofと同じ。【紛らわしい選択肢】wrapped up in（～に夢中になっている）。,,,,,,,,,,,,,,,,
415,2023-3,It has probably ( ). I’ll get some more...,gone bad,come close,broken out,passed away,熟語・腐る,たぶん腐っちゃったんだわ。あとで買ってくるわ。,【正解のポイント】食品が悪くなる。go bad（腐る）。【紛らわしい選択肢】passed away（亡くなった）。,,,,,,,,,,,,,,,,
416,2023-3,"Isaac’s mother asked him ( ) he was hungry, and he said no.",if,when,how,as,文法・接続詞,アイザックの母は彼に空腹かどうか尋ね、彼はいいえと言いました。,【正解のポイント】～かどうか。if（whether）。Yes/Noで答える質問の間接話法。,,,,,,,,,,,,,,,,
417,2023-3,"But we don’t have enough money this year to go to the beach, ( ) overseas.",much less,much more,less than,more than,文法・比較,今年は海に行くお金も十分にないのに、まして海外なんて（なおさらないわ）。,"【正解のポイント】否定文, much less ...（まして...はない）。still lessとも言う。肯定文ならmuch more。",,,,,,,,,,,,,,,,
418,2023-3,"( ) Mr. Anderson stop by the office while I’m away, please tell him...",Should,Shall,Could,Can,文法・倒置,万が一私が留守中にアンダーソンさんが立ち寄ったら、伝えてください...,【正解のポイント】If S should...のIf省略による倒置。Should Mr. Anderson stop by... = If Mr. Anderson should stop by...（万が一～なら）。,,,,,,,,,,,,,,,,
419,2023-1,...criminals have been able to produce ( ) coins and bills.,fake,rare,foreign,golden,長文語彙・偽の,犯罪者たちは偽の硬貨や紙幣を作ることができています。,【正解のポイント】長文（Any Change?）より。文脈から「偽造」の意味。fake（偽の）。counterfeitと同義。,,,,,,,,,,,,,,,,
420,2023-2,...experts had difficulty explaining how these man-made objects had ended up at the bottom of the ocean. The only possible explanation was that sea levels must have been much lower...,Therefore,However,Otherwise,Instead,長文語彙・接続詞,専門家は...説明するのに苦労しました。（それゆえ）唯一の可能な説明は...ということでした。,【正解のポイント】長文（Doggerland）より。論理的帰結。Therefore（それゆえに）。,,,,,,,,,,,,,,,,
421,2023-3,Dictionary editors and their assistants read books... to look for new words. ... The people who create dictionaries need to constantly check which words are being used...,editors,authors,printers,translators,長文語彙・編集者,辞書の編集者とその助手たちは...新しい言葉を探します。,【正解のポイント】長文（Keeping Up-to-Date）より。本や辞書を作る人。editors（編集者）。,,,,,,,,,,,,,,,,
422,2024-1,There are several ( ) to consider before making a decision about the school’s future.,factors,palaces,manuscripts,victims,名詞・要因,学校の将来について決定を下す前に、考慮すべきいくつかの要因があります。,【正解のポイント】原因や考慮すべき要素。factors（要因）。準1級や英作文でArgumentsを作る際の必須語です。【紛らわしい選択肢】manuscripts（原稿）。,,,,,,,,,,,,,,,,
423,2024-1,He was surprised to discover that the walls were bright red ( ).,underneath,upstairs,definitely,downhill,副詞・その下に,彼は壁紙の下が鮮やかな赤色だったことを発見して驚きました。,【正解のポイント】位置関係。underneath（（表面の）下に）。underより「覆われている」ニュアンスが強いです。【紛らわしい選択肢】definitely（絶対に）。,,,,,,,,,,,,,,,,
424,2024-1,...researchers still have not found a way to ( ) a cold.,cure,grant,flee,drop,動詞・治療する,...研究者たちはまだ風邪を治す方法を見つけていません。,【正解のポイント】病気を治す。cure（治療する）。heal（傷を癒やす）との使い分けに注意。【紛らわしい選択肢】grant（与える、認める）は準1級重要語。,,,,,,,,,,,,,,,,
425,2024-1,...the producer felt a lot of pressure to ( ) a new show of the same quality.,create,reduce,heal,sweep,動詞・創造する,...プロデューサーは同じ質の新しい番組を作ることに多くのプレッシャーを感じていました。,【正解のポイント】番組を制作する。create（創造する、作る）。【紛らわしい選択肢】reduce（減らす）。,,,,,,,,,,,,,,,,
426,2024-1,One of the most important values of France is ( ). The country has many laws that make sure people are free...,liberty,behavior,composition,attendance,名詞・自由,フランスの最も重要な価値観の一つは自由です。,【正解のポイント】freedomの堅い語。liberty（自由）。Statue of Liberty（自由の女神）。【紛らわしい選択肢】composition（構成、作文）。,,,,,,,,,,,,,,,,
427,2024-1,"Janet answered every question on her history test ( ), so the teacher gave her a perfect score.",correctly,eventually,loudly,obviously,副詞・正確に,ジャネットは歴史のテストの全問に正解した（正確に答えた）ので、先生は満点を与えました。,【正解のポイント】間違いなく。correctly（正しく）。correct（修正する・正しい）。【紛らわしい選択肢】eventually（ついに、結局は）。,,,,,,,,,,,,,,,,
428,2024-1,"Wow, Amanda! That’s a great ( ). Let’s celebrate...",achievement,requirement,combination,donation,名詞・達成,わあ、アマンダ！ それは偉大な達成（功績）だね。お祝いしよう...,【正解のポイント】成し遂げたこと。achievement（達成、業績）。achieveの名詞形。【紛らわしい選択肢】requirement（必要条件）、donation（寄付）。,,,,,,,,,,,,,,,,
429,2024-1,"He could not ( ) many of the ideas in the lecture, so he went to the library to study...",grasp,frighten,harm,lack,動詞・把握する,彼は講義のアイデアの多くを把握できなかったので、図書館へ勉強しに行きました。,【正解のポイント】物理的に「掴む」だけでなく、概念を「理解する」という意味で頻出。grasp（把握する）。understandと同義。【紛らわしい選択肢】lack（欠いている）。,,,,,,,,,,,,,,,,
430,2024-1,Americans often need to ( ) the measurements to miles per hour in order to understand...,convert,resign,derive,filter,動詞・変換する,アメリカ人は理解するために、測定値を時速マイルに変換する必要があります。,【正解のポイント】単位や形式を変える。convert（変換する、改宗させる）。computer scienceでも使われます。【紛らわしい選択肢】derive（引き出す、由来する）。,,,,,,,,,,,,,,,,
431,2024-1,"( ), he learned how to cook a dish called feijoada...",For instance,At random,In exchange,On purpose,熟語・例えば,例えば、彼はフェイジョアーダという料理の作り方を学びました...,【正解のポイント】具体例の提示。For instance（例えば）。For exampleと同じ。【紛らわしい選択肢】In exchange（交換に）。,,,,,,,,,,,,,,,,
432,2024-1,"( ), Sam finishes his homework before eating dinner. Sometimes, however...",As a general rule,In the long run,Over and over,On the contrary,熟語・概して,原則として（普段は）、サムは夕食前に宿題を終えます。,【正解のポイント】一般的・規則的な習慣。As a general rule（概して、原則として）。exception（例外）との対比で使われます。【紛らわしい選択肢】In the long run（長い目で見れば）。,,,,,,,,,,,,,,,,
433,2024-1,"I’ve been patient with you ( ), Jamie, but this is the last time.",up until now,up in the air,at the bottom,at the same time,熟語・今までは,ジェイミー、今までは我慢してきたけど、これが最後よ。,【正解のポイント】現在に至るまで。up until now（今までは）。【紛らわしい選択肢】up in the air（未定で）。,,,,,,,,,,,,,,,,
434,2024-1,...his little sister goes with them and ( ) the score in her notebook.,keeps track of,makes sense of,keeps pace with,makes do with,熟語・記録する,...彼の妹が一緒に行って、ノートにスコアを記録します。,【正解のポイント】動きや変化を追う。keep track of（～の記録をつける、～を見失わないようにする）。【紛らわしい選択肢】make sense of（～を理解する）。,,,,,,,,,,,,,,,,
435,2024-1,He wanted to leave the company ( ).,on good terms,by no means,out of hand,at first sight,熟語・良好な関係で,彼は会社を円満に（良好な関係で）辞めたいと思っていました。,【正解のポイント】仲が良い状態。on good terms (with)（～と仲が良い）。【紛らわしい選択肢】by no means（決して～ない）。,,,,,,,,,,,,,,,,
436,2024-1,"However, it started to shake in the wind, so she ( ) and turned around.",had second thoughts,closed in on,made ends meet,got back together,熟語・考え直す,しかし、風で揺れ始めたので、彼女は考え直して（迷って）引き返しました。,【正解のポイント】一度決めたことを疑う。have second thoughts（考え直す、二の足を踏む）。2018年にも出題された重要表現。【紛らわしい選択肢】made ends meet（収支を合わせる）。,,,,,,,,,,,,,,,,
437,2024-2,"...he stepped on a soft, wet ( ). He found out that his daughter had accidentally spilled some yogurt.",substance,drawing,landscape,criminal,名詞・物質,...彼は柔らかくて濡れた物質を踏みました。,【正解のポイント】特定できない物。substance（物質、実体）。scientific substance（化学物質）など。【紛らわしい選択肢】criminal（犯罪者）。,,,,,,,,,,,,,,,,
438,2024-2,Scientists will use it to study ( ) stars and planets that are too far away to be seen from Earth.,distant,primary,registered,visible,形容詞・遠い,科学者たちは、地球からは遠すぎて見えない遠くの星や惑星を研究するためにそれを使います。,【正解のポイント】距離が離れている。distant（遠い）。distance（距離）の形容詞。【紛らわしい選択肢】visible（目に見える）はto be seenと重複するため不適。,,,,,,,,,,,,,,,,
439,2024-2,...so the farm ( ) a large amount of produce.,yielded,struggled,decreased,regretted,動詞・産出する,...その農場は大量の農作物を産出しました。,【正解のポイント】（作物や利益を）生み出す。yielded（産出した）。準1級では「屈服する（yield to）」の意味でも出ます。【紛らわしい選択肢】struggled（苦闘した）。,,,,,,,,,,,,,,,,
440,2024-2,"Give it some more time, Barry. Your ankle will get better ( ).",eventually,slightly,socially,respectably,副詞・そのうち,もう少し時間をかけなさい、バリー。足首はそのうち（最終的には）良くなるよ。,【正解のポイント】時間が経てば。eventually（結局は、いつかは）。finallyより過程を含んだニュアンス。【紛らわしい選択肢】slightly（わずかに）。,,,,,,,,,,,,,,,,
441,2024-2,"Many years ago, smoke from the factories in Silver City ( ) the air.",polluted,arrested,cured,established,動詞・汚染する,何年も前、シルバーシティの工場からの煙が空気を汚染していました。,【正解のポイント】環境を汚す。polluted（汚染した）。pollution（汚染）。【紛らわしい選択肢】established（設立した）。,,,,,,,,,,,,,,,,
442,2024-2,The ( ) of education is responsible for ensuring that the country’s schools... are being managed well.,minister,dawn,faith,immigrant,名詞・大臣,教育大臣は、国の学校...が適切に管理されていることを保証する責任があります。,【正解のポイント】政府の責任者。minister（大臣）。Prime Minister（首相）。【紛らわしい選択肢】immigrant（移民）。,,,,,,,,,,,,,,,,
443,2024-2,The soccer game... was ( ) because of the heavy rain.,postponed,obeyed,recovered,tricked,動詞・延期する,大雨のため、サッカーの試合は延期されました。,【正解のポイント】put offと同義。postponed（延期した）。post（後ろへ）+pone（置く）。【紛らわしい選択肢】obeyed（従った）。,,,,,,,,,,,,,,,,
444,2024-2,"Many years ago, France was ruled by an ( ).",emperor,opinion,element,operation,名詞・皇帝,何年も前、フランスは皇帝によって統治されていました。,【正解のポイント】帝国の支配者。emperor（皇帝）。empire（帝国）とセットで。【紛らわしい選択肢】operation（手術、操作）。,,,,,,,,,,,,,,,,
445,2024-2,The city held a big ( ) for computer game fans last weekend.,convention,miracle,criticism,monument,名詞・大会,市は先週末、コンピュータゲームファンのための大きな大会（集会）を開催しました。,【正解のポイント】大規模な集まり。convention（大会、慣習）。【紛らわしい選択肢】criticism（批判）。,,,,,,,,,,,,,,,,
446,2024-2,Ron hates it when his friends ( ) on him at his home without telling him first.,drop in,keep an eye,have an effect,step up,句動詞・立ち寄る,ロンは、友人が前もって言わずに家にふらっと立ち寄るのが嫌いです。,【正解のポイント】予告なしに訪問する。drop in (on someone)。visit casually。【紛らわしい選択肢】keep an eye (on)（～を見張る）。,,,,,,,,,,,,,,,,
447,2024-2,I’ll ( ) my old computer for a few more months while I save up some more money.,make do with,give up on,look out for,show up to,句動詞・間に合わせる,お金が貯まるまでの数ヶ月間、古いコンピュータで間に合わせるつもりです。,【正解のポイント】十分ではないがそれで済ませる。make do with（～で間に合わせる）。準1級への架け橋となる重要イディオム。【紛らわしい選択肢】give up on（～に見切りをつける）。,,,,,,,,,,,,,,,,
448,2024-2,...but he was ( ) finishing it because he got some phone calls...,kept from,parted with,taken in,aimed at,句動詞・妨げられる,...しかし電話がかかってきたため、彼はそれを終えるのを妨げられました。,【正解のポイント】keep A from ～ing（Aが～するのを妨げる）。prevent A from ～ingと同じ。【紛らわしい選択肢】parted with（手放した）。,,,,,,,,,,,,,,,,
449,2024-2,The bus doesn’t come for another hour. How are we going to ( ) until then?,kill time,make sense,take part,pay attention,熟語・時間をつぶす,バスはあと1時間来ないよ。それまでどうやって時間をつぶそうか？,【正解のポイント】暇な時間を過ごす。kill time（時間をつぶす）。【紛らわしい選択肢】make sense（意味をなす）。,,,,,,,,,,,,,,,,
450,2024-2,The children who attend the summer camp ( ) their parents’ letters.,long for,jump into,pull through,fall behind,句動詞・待ち望む,サマーキャンプに参加している子供たちは、親からの手紙を待ち望んでいます。,【正解のポイント】切望する。long for（～を恋しがる、熱望する）。long（長い）ではなく動詞のlong。【紛らわしい選択肢】fall behind（遅れをとる）。,,,,,,,,,,,,,,,,
451,2024-2,"Robert is proud to be a firefighter. When he is ( ), he is always ready to help...",on duty,in common,at random,by chance,熟語・勤務中,ロバートは消防士であることを誇りに思っています。勤務中は、いつでも助ける準備ができています。,【正解のポイント】仕事中である。on duty（勤務中）。対義語はoff duty。【紛らわしい選択肢】in common（共通して）。,,,,,,,,,,,,,,,,
452,2024-2,Lola forgot to ( ) the train at her stop this morning...,get off,get by,get through,get along,句動詞・降りる,ローラは今朝、自分の駅で電車を降りるのを忘れました...,【正解のポイント】乗り物から降りる。get off。【紛らわしい選択肢】get by（なんとかやっていく）、get along（仲良くやる）。,,,,,,,,,,,,,,,,
453,2024-3,"However, she now has an online ( ), so she can read the magazine on her tablet...",subscription,opportunity,campaign,representative,名詞・定期購読,しかし、今はオンラインの定期購読をしているので、タブレットで雑誌を読めます。,【正解のポイント】定期的に購入するサービス。subscription（定期購読、サブスク）。subscribe（購読する）。【紛らわしい選択肢】representative（代表者）。,,,,,,,,,,,,,,,,
454,2024-3,I didn’t mean to ( ) you. I shouldn’t have said that.,offend,replace,comfort,transform,動詞・気分を害する,君を怒らせるつもりはなかったんだ。あんなこと言うべきじゃなかった。,【正解のポイント】感情を傷つける。offend（気分を害させる）。offensive（不快な）も重要。【紛らわしい選択肢】comfort（慰める）。,,,,,,,,,,,,,,,,
455,2024-3,Greg likes his new apartment because it has a lot of room for ( ).,storage,reverse,heaven,denial,名詞・収納,グレッグは収納スペースがたくさんあるので、新しいアパートが気に入っています。,【正解のポイント】物を保管する場所。storage（保管、収納）。store（蓄える）の名詞形。【紛らわしい選択肢】denial（否定）。,,,,,,,,,,,,,,,,
456,2024-3,Ms. Walker asks her students to think about the ( ) of their actions.,consequences,requests,timetables,suitcases,名詞・結果,ウォーカー先生は生徒たちに、自分の行動の結果（影響）について考えるよう求めています。,【正解のポイント】行動に伴う重大な結果。consequences（結果）。resultより因果関係の重みがある準1級必須語。【紛らわしい選択肢】requests（要求）。,,,,,,,,,,,,,,,,
457,2024-3,"...so he and his wife went ( ) to their friends’ dinner party. Mike took a taxi, while his wife drove their car.",separately,meanwhile,nowadays,permanently,副詞・別々に,...だから彼と妻は別々に友人のディナーパーティーに行きました。,【正解のポイント】一緒ではなく。separately（別々に）。individuallyに近い。【紛らわしい選択肢】permanently（永久に）。,,,,,,,,,,,,,,,,
458,2024-3,Sam told her the ( ) the next day. The Wolves had won 5 to 3.,outcome,appetite,victim,conflict,名詞・結果,サムは翌日、彼女に結果を伝えました。ウルブズが5対3で勝っていました。,【正解のポイント】試合や選挙の最終結果。outcome（結果）。come out（出てくる）もの。【紛らわしい選択肢】appetite（食欲）。,,,,,,,,,,,,,,,,
459,2024-3,...economic activities that ( ) global warming.,accelerate,remain,compose,launch,動詞・加速させる,...地球温暖化を加速させる経済活動。,【正解のポイント】速度を上げる、早める。accelerate（加速する）。access（接近）と混同しないように。【紛らわしい選択肢】compose（構成する）。,,,,,,,,,,,,,,,,
460,2024-3,The company’s ( ) situation has been getting worse this year.,financial,attractive,national,ignorant,形容詞・財政的な,その会社の財政状況は今年悪化しています。,【正解のポイント】お金に関すること。financial（財政の、金融の）。finance（財政）。【紛らわしい選択肢】ignorant（無知な）。,,,,,,,,,,,,,,,,
461,2024-3,The boat is starting to ( ) away from the shore.,drift,split,resolve,grasp,動詞・漂流する,ボートが岸から漂流し始めています。,【正解のポイント】水や風に流される。drift（漂う）。drifting wood（流木）。【紛らわしい選択肢】resolve（解決する）。,,,,,,,,,,,,,,,,
462,2024-3,A statue was put up in front of city hall ( ) of the city’s first mayor.,in honor,for lack,at risk,on suspicion,熟語・～に敬意を表して,市の初代市長に敬意を表して、市庁舎の前に像が建てられました。,【正解のポイント】in honor of（～を記念して、～に敬意を表して）。【紛らわしい選択肢】on suspicion of（～の容疑で）。,,,,,,,,,,,,,,,,
463,2024-3,"I don’t think I’ve ever seen Bob take a break. - Yes, he’s always ( ).",on the go,in the way,by the book,to the point,熟語・働きづめで,ボブが休憩しているのを見たことがないよ。- ああ、彼はいつも働きづめだよ。,【正解のポイント】2020年にも出題された熟語。on the go（活動して、働きづめで）。【紛らわしい選択肢】by the book（規則通りに）。,,,,,,,,,,,,,,,,
