ID,出典,問題文,正解,誤答1,誤答2,誤答3,意味・分類タグ,文意訳（ヒント）,解説,,,,,,,,,,,,,,,,
226,2020-3,"These days, she only does it ( ) because she is very busy.",now and then,up and down,all the way,not at all,熟語・時々,最近、彼女はとても忙しいので、時々しかそれをしません。,【正解のポイント】occasionallyの熟語。now and then（時々）。from time to timeと同じ。,,,,,,,,,,,,,,,,
227,2020-3,"Victor likes his new job because he is always ( ). He uses taxis, trains...",on the go,above all else,out of place,at a distance,熟語・忙しく動き回って,ビクターはいつもあちこち飛び回っているので、新しい仕事が好きです。,【正解のポイント】活動的である。on the go（働きづめで、活動中で）。busy and active。【紛らわしい選択肢】out of place（場違いで）。,,,,,,,,,,,,,,,,
228,2020-3,"Becky was ( ) her low test scores, so she did not want to speak to any of her friends.",ashamed of,rid of,accustomed to,familiar to,熟語・恥じて,ベッキーは低いテストの点数を恥じていたので、誰とも話したくありませんでした。,【正解のポイント】be ashamed of（～を恥じている）。shame（恥）の形容詞。【紛らわしい選択肢】rid of（～を取り除いて）。,,,,,,,,,,,,,,,,
229,2020-3,Breakfast ( ) to be the most important meal of the day.,is said,has said,says,is saying,文法・受動態,朝食は一日で最も重要な食事だと言われています。,【正解のポイント】It is said that...の書き換え。Breakfast is said to be...（～だと言われている）。,,,,,,,,,,,,,,,,
230,2020-3,It is because the Bluestreet Girls sing and dance so well ( ) they are so popular.,that,if,how,why,文法・強調構文,ブルーストリート・ガールズが人気があるのは、歌とダンスがとてもうまいからです。,【正解のポイント】It is ... thatの強調構文。because節を強調しています。,,,,,,,,,,,,,,,,
231,2020-3,This project is going to be very difficult... ( ) cancel it?,Why not,What about,What for,How come,熟語・～したらどう？,このプロジェクトは難しくなりますよ...中止したらどうですか？（いや中止しない）,【正解のポイント】提案、または反語。文脈を見るとBがNoと言っているので、「中止しませんか（＝中止しましょうよ）」という提案に対し「いや、利益が出るからやらない」と返しています。Why not do...?（～してはどう？）,,,,,,,,,,,,,,,,
232,2020-3,"Nevertheless, e­bikes are quickly ( ).",growing in popularity,reducing electricity use,causing new problems,improving the environment,長文語彙・人気が出る,それにもかかわらず、電動自転車は急速に人気が高まっています。,【正解のポイント】長文（Cycles of Change）の空所補充。売上が8倍になったという文脈につながる選択肢。growing in popularity（人気が高まっている）。,,,,,,,,,,,,,,,,
233,2020-3,One common challenge in farming is that a lot of direct sunlight ( ).,damages crops,is difficult to find,attracts more insects,makes vegetables taste bad,長文語彙・作物に害を与える,農業のよくある課題の一つは、多くの直射日光が作物に害を与えることです。,【正解のポイント】長文（Solar Power）の空所補充。葉が茶色くなったり乾燥したりするという説明から、damage（害）を選びます。,,,,,,,,,,,,,,,,
234,2021-1,...now the project is being run ( ) by the marketing department.,entirely,needlessly,scientifically,violently,副詞・完全に,...今ではそのプロジェクトはマーケティング部によって「完全に（単独で）」運営されています。,【正解のポイント】以前は共同だったが今は...という文脈。entirely（完全に、全体的に）。solelyに近いニュアンス。【紛らわしい選択肢】needlessly（不必要に）、violently（暴力的に）。,,,,,,,,,,,,,,,,
235,2021-1,"Experts... discovered that one of their paintings, which they had thought was a ( ) Picasso, was actually just a copy.",genuine,severe,logical,portable,形容詞・本物の,専門家たちは、本物のピカソだと思っていた絵画が、実際にはただの模写であることを発見しました。,【正解のポイント】copy（模写）との対比。genuine（本物の、真の）。authenticと同義で準1級・1級必須語です。【紛らわしい選択肢】severe（厳しい）、logical（論理的な）。,,,,,,,,,,,,,,,,
236,2021-1,The musician Jimmy Baker had a lot of ( ) when he was a child. His family was very poor...,hardship,permission,membership,concentration,名詞・苦難,ミュージシャンのジミー・ベイカーは子供の頃、多くの苦難を経験しました。彼の家族はとても貧しく...,【正解のポイント】貧しかった＝苦労した。hardship（苦難、困窮）。hard（辛い）+ship（状態）。【紛らわしい選択肢】permission（許可）。,,,,,,,,,,,,,,,,
237,2021-1,Mother Teresa... was known as a person who cared about ( ).,humanity,generation,gravity,hesitation,名詞・人類・人間性,マザー・テレサは人類（人々）を思いやる人として知られていました。,【正解のポイント】多くの人を助けた人。humanity（人類、人間性）。humanitarian（人道的な）につながる語。【紛らわしい選択肢】hesitation（ためらい）、gravity（重力・重大さ）。,,,,,,,,,,,,,,,,
238,2021-1,He had the ( ) that someone was watching him.,sensation,feature,translation,property,名詞・感覚,彼は誰かが自分を見ているような感覚を覚えました。,【正解のポイント】五感や予感。sensation（感覚、感じ）。senseより「具体的な感じ」を指します。【紛らわしい選択肢】property（財産、特性）。,,,,,,,,,,,,,,,,
239,2021-1,She says that drinking it is good because it has many ( ) that her body needs.,minerals,campaigns,operations,illustrations,名詞・ミネラル,彼女は、体が及ぶ多くのミネラルを含んでいるので、それを飲むのは良いことだと言っています。,【正解のポイント】水に含まれる栄養素。minerals（ミネラル、鉱物）。【紛らわしい選択肢】campaigns（キャンペーン、運動）。,,,,,,,,,,,,,,,,
240,2021-1,The lifeguard ran into the ocean to help a young girl who looked like she was ( ) in the big waves.,drowning,proposing,converting,exporting,動詞・溺れる,ライフガードは、大波の中で溺れているように見えた少女を助けるために海に走りました。,【正解のポイント】海での救助。drowning（溺れている）。【紛らわしい選択肢】converting（転換する）、exporting（輸出する）。,,,,,,,,,,,,,,,,
241,2021-1,It melted so quickly that she could not help ( ) some on her dress.,spilling,arguing,convincing,maintaining,動詞・こぼす,あまりに早く溶けたので、彼女はドレスに少しこぼさずにはいられませんでした。,【正解のポイント】液体を落とす。spilling（こぼす）。cannot help ～ing（～せずにはいられない）の構文も重要。【紛らわしい選択肢】convincing（納得させる）。,,,,,,,,,,,,,,,,
242,2021-1,"In the past, sailors had to use the stars to ( ) when they were on an ocean.",navigate,satisfy,respect,permit,動詞・航海する,昔、船乗りたちは海にいるとき、星を使って航海しなければなりませんでした。,【正解のポイント】方向を決めて進む。navigate（航海する、操縦する）。GPS（Navigation System）の語源。【紛らわしい選択肢】permit（許可する）。,,,,,,,,,,,,,,,,
243,2021-1,...goes for a long walk every evening to ( ) her health.,preserve,interpret,replace,betray,動詞・保つ,...彼女の健康を保つ（維持する）ために毎晩長い散歩に行きます。,【正解のポイント】健康維持。preserve（保つ、保護する）。maintainと同義。【紛らわしい選択肢】interpret（通訳する、解釈する）、betray（裏切る）。,,,,,,,,,,,,,,,,
244,2021-1,Theresa knew ( ) first sight that Joe was a nice person...,at,in,of,to,熟語・一目で,テレサはジョーが良い人だと一目でわかりました...,【正解のポイント】at first sight（一目で、直ちに）。love at first sight（一目惚れ）。,,,,,,,,,,,,,,,,
245,2021-1,"Well, he’s very ( ) about wine. You’d better ask him what kind he wants.",particular,sweet,guilty,enormous,熟語・好みがうるさい,そうね、彼はワインにはとてもこだわりがある（うるさい）のよ。,【正解のポイント】be particular about（～について好みがうるさい、詳細にこだわる）。pickyと言い換え可能。【紛らわしい選択肢】guilty（有罪の、罪悪感がある）。,,,,,,,,,,,,,,,,
246,2021-1,"Sam, what time do you want me to ( ) you off at the movie theater?",drop,pick,take,mark,句動詞・車で送る,サム、何時に映画館で降ろして（送って）ほしい？,【正解のポイント】車から降ろす。drop off。pick up（迎えに行く）の対義語。【紛らわしい選択肢】pick you off（狙い撃ちする）になってしまいます。,,,,,,,,,,,,,,,,
247,2021-1,"I’m sorry, sir. The sale does not ( ) belts or wallets.",apply to,vote for,put off,tie up,熟語・適用される,申し訳ありません、お客様。セールはベルトや財布には適用されません。,【正解のポイント】ルールなどが当てはまる。apply to（～に適用される）。apply for（～に申し込む）との違いに注意。【紛らわしい選択肢】put off（延期する）。,,,,,,,,,,,,,,,,
248,2021-1,...so she is going to shop online to find one ( ).,for sure,for instance,in short,in vain,熟語・確実に,...だから彼女は確実にそれを見つけるためにオンラインで買い物をするつもりです。,【正解のポイント】間違いなく手に入れる。for sure（確実に）。【紛らわしい選択肢】in vain（無駄に）、for instance（例えば）。,,,,,,,,,,,,,,,,
249,2021-1,A heavy storm ( ) in Montaine Valley last month.,did a lot of harm,had some difficulty,took a break,found fault,熟語・害を及ぼす,先月、激しい嵐がモンテーニュ渓谷に大きな被害をもたらしました。,【正解のポイント】do harm（害を与える）。do damageと同じ用法。【紛らわしい選択肢】found fault (with)（～のあら探しをする）。,,,,,,,,,,,,,,,,
250,2021-1,She wants to spend her time working ( ) other people.,for the benefit of,at the sight of,for a change of,at the thought of,熟語・～のために,彼女は他人の利益のために（他人のために）働いて時間を過ごしたいと思っています。,【正解のポイント】for the benefit of（～の利益のために、～のために）。benefitは準1級の重要テーマ。【紛らわしい選択肢】at the sight of（～を見て）。,,,,,,,,,,,,,,,,
251,2021-1,It’s time we ( ) for the station.,left,have left,had left,will have left,文法・仮定法,もう駅に向かう時間だよ。,【正解のポイント】It's time S + 過去形（もう～してもよい時間だ）。仮定法過去の慣用表現。,,,,,,,,,,,,,,,,
252,2021-1,It was so noisy at the concert that Jane struggled to ( ).,make herself heard,make heard herself,hearing herself made,herself made heard,文法・使役動詞,コンサート会場はとてもうるさかったので、ジェーンは自分の声を聞いてもらうのに苦労しました。,【正解のポイント】make oneself heard（自分の声を届かせる）。過去分詞heardを使うのがポイント。,,,,,,,,,,,,,,,,
253,2021-1,"However, Ms. Garcia is not ( ) as he is...",as kind a person,a kind as person,as a kind person,as person a kind,文法・語順,しかし、ガルシア先生は彼ほど親切な人ではありません...,【正解のポイント】as + 形容詞 + a + 名詞 + as...（...と同じくらい～な名詞）。語順整序の頻出パターン。,,,,,,,,,,,,,,,,
254,2021-1,"In the 1970s, an Englishman named John Seymour promoted the idea of ( ).",self-sufficiency,self-esteem,self-defense,self-control,長文語彙・自給自足,1970年代、ジョン・シーモアという英国人が自給自足の考えを広めました。,【正解のポイント】長文（Self-Sufficient Communities）のテーマ。self（自分）+ sufficient（十分な）＝自給自足。準1級重要語。,,,,,,,,,,,,,,,,
255,2021-2,Carrie wants her children to speak more ( )...,politely,luckily,commonly,silently,副詞・丁寧に,キャリーは子供たちにもっと丁寧に話してほしいと思っています...,【正解のポイント】PleaseやThank youを言う＝礼儀正しい。politely（丁寧に）。【紛らわしい選択肢】commonly（一般的に）。,,,,,,,,,,,,,,,,
256,2021-2,Many people... choose ( ) products instead of foreign ones...,domestic,manual,routine,formal,形容詞・国内の,多くの人々は、外国製品の代わりに国内製品を選びます...,【正解のポイント】foreign（外国の）の対義語。domestic（国内の、家庭の）。GDP（Gross Domestic Product）のDです。【紛らわしい選択肢】manual（手動の）。,,,,,,,,,,,,,,,,
257,2021-2,"I’m going to be away next week, so please ( ) your assignment to Ms. Edwards.",submit,beat,convert,imply,動詞・提出する,来週は不在にしますので、課題はエドワーズ先生に提出してください。,【正解のポイント】hand inのフォーマル表現。submit（提出する）。準1級では「服従する」の意味でも出ます。【紛らわしい選択肢】imply（ほのめかす）。,,,,,,,,,,,,,,,,
258,2021-2,He put pictures on the web page and wrote a detailed ( ) of each item.,description,route,hammer,symphony,名詞・説明,彼はウェブページに写真を載せ、各商品の詳細な説明を書きました。,【正解のポイント】詳細な解説。description（記述、説明）。describe（描写する）の名詞形。【紛らわしい選択肢】symphony（交響曲）。,,,,,,,,,,,,,,,,
259,2021-2,The police had ( ) that showed the man had robbed the bank.,evidence,harmony,rhythm,praise,名詞・証拠,警察は、その男が銀行を襲ったことを示す証拠を持っていました。,【正解のポイント】犯罪を証明するもの。evidence（証拠）。不可算名詞である点も注意。【紛らわしい選択肢】praise（賞賛）。,,,,,,,,,,,,,,,,
260,2021-2,Johann’s hobby is ( ) music. He wrote a beautiful song...,composing,rescuing,flattering,declaring,動詞・作曲する,ヨハンの趣味は作曲です。彼は美しい歌を書きました...,【正解のポイント】音楽を作る。composing（作曲する、構成する）。composition（作文・構成）も重要。【紛らわしい選択肢】flattering（お世辞を言う）、declaring（宣言する）。,,,,,,,,,,,,,,,,
261,2021-2,Andy focused on ( ) for his science report. It was about how certain birds lost the ability to fly...,evolution,landscape,humanity,psychology,名詞・進化,アンディは科学レポートで進化に焦点を当てました。,【正解のポイント】生物が長い時間をかけて変化すること。evolution（進化）。evolve（進化する）。【紛らわしい選択肢】psychology（心理学）。,,,,,,,,,,,,,,,,
262,2021-2,Lisa and her brother had an ( ) about whose turn it was to wash the dishes.,argument,occasion,identity,expense,名詞・口論,リサと弟は、誰が皿洗いをする順番かについて口論になりました。,【正解のポイント】言い争い。argument（議論、口論）。argue（議論する）。【紛らわしい選択肢】expense（費用）。,,,,,,,,,,,,,,,,
263,2021-2,Kate closed her bedroom window because the sound of the construction on her street was ( ) her.,irritating,judging,detecting,exchanging,動詞・イライラさせる,通りの工事の音が彼女をイライラさせていたので、ケイトは窓を閉めました。,【正解のポイント】不快にさせる。irritating（イライラさせる）。annoyingより強いニュアンス。【紛らわしい選択肢】detecting（探知する）。,,,,,,,,,,,,,,,,
264,2021-2,"This morning, Mr. Ikeda was tired at work because he ( ) all night taking care of his baby girl.",stayed up,spoke up,left over,looked over,句動詞・起きている,今朝、池田さんは一晩中起きて赤ちゃんの世話をしていたので、仕事中疲れていました。,【正解のポイント】寝ないで起きている。stay up。sit upとも言います。【紛らわしい選択肢】look over（ざっと目を通す）。,,,,,,,,,,,,,,,,
265,2021-2,Do you think $400 will be ( ) three days in New York?,sufficient for,obliged to,capable of,particular about,熟語・十分な,ニューヨークでの3日間、400ドルで十分だと思いますか？,【正解のポイント】足りるかどうか。sufficient for（～に十分な）。enoughの堅い語。【紛らわしい選択肢】obliged to（～する義務がある/感謝している）。,,,,,,,,,,,,,,,,
266,2021-2,"...made outstanding contributions to the study of the solar system, to say ( ) of his research in physics.",nothing,worse,further,better,熟語・言うまでもなく,...物理学の研究は言うまでもなく、太陽系の研究に傑出した貢献をしました。,【正解のポイント】to say nothing of（～は言うまでもなく）。not to mentionと同じ。【紛らわしい選択肢】say no more（もう言うな）などと混同しないように。,,,,,,,,,,,,,,,,
267,2021-2,"Yeah, I’m getting ( ) of it. I wish she’d stop.",sick,low,hard,lazy,熟語・うんざり,ああ、もううんざりだよ。彼女がやめてくれればいいのに。,【正解のポイント】be sick of（～にうんざりしている）。tired ofより強い嫌悪感。【紛らわしい選択肢】getting hard（難しくなっている）。,,,,,,,,,,,,,,,,
268,2021-2,Michael is going to ( ) as captain.,take over,drive off,make sure,pull down,句動詞・引き継ぐ,マイケルがキャプテンを引き継ぐ予定です。,【正解のポイント】仕事や役割を代わる。take over（引き継ぐ）。【紛らわしい選択肢】pull down（取り壊す）。,,,,,,,,,,,,,,,,
269,2021-2,Let me see if I can ( ) the car salesperson into giving us a discount...,talk,run,burst,divide,句動詞・説得する,値引きしてくれるよう、私が店員を説得できるかやってみるわ...,【正解のポイント】talk A into B（Aを説得してBさせる）。persuade A to do Bのイディオム版。反対はtalk A out of B。,,,,,,,,,,,,,,,,
270,2021-2,Everyone in his section ( ) him for his wonderful ideas and hard work.,looks up to,moves on with,does away with,takes away from,句動詞・尊敬する,課の全員が、素晴らしいアイデアと勤勉さゆえに彼を尊敬しています。,【正解のポイント】respectのイディオム。look up to（尊敬する）。対義語はlook down on（見下す）。,,,,,,,,,,,,,,,,
271,2021-2,"If Tom’s grandparents ( ) a computer last year, they’d still be using their old typewriter.",hadn’t bought,haven’t bought,wouldn’t buy,don’t buy,文法・仮定法,もしトムの祖父母が昨年コンピュータを買っていなかったら、今でも古いタイプライターを使っているだろう。,【正解のポイント】If S had p.p.（過去の事実に反する仮定＝仮定法過去完了）。後半がwould be using（今の話）なので混合仮定法です。,,,,,,,,,,,,,,,,
272,2021-2,"( ) her efforts, she could not win.",Despite,Above,Outside,Within,前置詞・～にもかかわらず,努力にもかかわらず、彼女は勝てませんでした。,【正解のポイント】In spite ofと同じ譲歩の前置詞。Despite（～にもかかわらず）。ofがつかない点に注意。,,,,,,,,,,,,,,,,
273,2021-2,He has been doing so ( ) since he became the club’s president earlier this year.,all the more,all the best,all the better,all the most,熟語・ますます,彼は今年初めに部長になって以来、ますますそうしています（助けています）。,【正解のポイント】all the more（それだけいっそう、ますます）。,,,,,,,,,,,,,,,,
274,2021-3,It was finally ( ) today and taken back to the zoo.,captured,proved,accused,neglected,動詞・捕獲する,それは今日ついに捕獲され、動物園に連れ戻されました。,【正解のポイント】逃げた動物を捕まえる。captured（捕まえた）。【紛らわしい選択肢】accused（告発した）、neglected（無視した、怠った）。,,,,,,,,,,,,,,,,
275,2021-3,Can you ( ) me to call my mother before we leave...?,remind,expect,distract,disturb,動詞・思い出させる,出発する前に母に電話するよう、私に思い出させて（気づかせて）くれない？,【正解のポイント】忘れないように言う。remind（思い出させる）。remind A to do。【紛らわしい選択肢】distract（気を散らす）、disturb（邪魔する）。,,,,,,,,,,,,,,,,
276,2021-3,He ( ) asked her to go on a date with him and was pleased when she said yes.,hesitantly,academically,spiritually,terribly,副詞・ためらいがちに,彼はためらいがちに彼女をデートに誘い、彼女がイエスと言ったとき喜びました。,【正解のポイント】自信なさげに。hesitantly（ためらいがちに）。hesitate（ためらう）の副詞。【紛らわしい選択肢】terribly（ひどく）。,,,,,,,,,,,,,,,,
277,2021-3,"Wendy, can you tell me the ( ) amount? - Our sales rose by exactly 21.8 percent.",precise,intense,endless,frequent,形容詞・正確な,ウェンディ、正確な数字を教えてくれる？ - 正確に21.8%増加しました。,【正解のポイント】exactly（正確に）に対応する形容詞。precise（正確な、精密な）。exactと同義。【紛らわしい選択肢】intense（強烈な）。,,,,,,,,,,,,,,,,
278,2021-3,Good teachers always use ( ) rather than threats to get their students to study.,persuasion,immigration,organization,admission,名詞・説得,良い教師は生徒に勉強させるために、脅しではなく説得を使います。,【正解のポイント】脅迫（threats）の対比。persuasion（説得）。persuade（説得する）の名詞形。【紛らわしい選択肢】immigration（移民・入国管理）。,,,,,,,,,,,,,,,,
279,2021-3,...she made sure to get some good ( ) for overseas travel...,insurance,violence,affection,punishment,名詞・保険,...彼女は海外旅行のために良い保険に必ず入るようにしました...,【正解のポイント】万が一の備え。insurance（保険）。【紛らわしい選択肢】punishment（罰）。,,,,,,,,,,,,,,,,
280,2021-3,"Actually, he just ( ) me. I couldn’t understand his complicated explanations.",confused,promoted,arrested,located,動詞・混乱させる,実は、彼は私を混乱させただけだったよ。彼の複雑な説明は理解できなかった。,【正解のポイント】わからなくさせる。confused（混乱させた）。【紛らわしい選択肢】located（位置を突き止めた）。,,,,,,,,,,,,,,,,
281,2021-3,Although the art gallery wanted to ( ) the painting right away...,exhibit,combine,imitate,overcome,動詞・展示する,美術館はその絵をすぐに展示したかったのですが...,【正解のポイント】絵を見せること。exhibit（展示する）。displayと同義。【紛らわしい選択肢】imitate（模倣する）、overcome（克服する）。,,,,,,,,,,,,,,,,
282,2021-3,Sorry I’m late for class... I don’t have a good ( ).,excuse,device,applause,resource,名詞・言い訳,遅刻してすみません...良い言い訳はありません。,【正解のポイント】理由を説明して許しを請うこと。excuse（言い訳）。make an excuseで「言い訳をする」。【紛らわしい選択肢】resource（資源）。,,,,,,,,,,,,,,,,
283,2021-3,"Every day, about 420,000 ( ) travel on it.",vehicles,tubes,rivals,deserts,名詞・車両,毎日約42万台の車両がそこ（高速道路）を通行します。,【正解のポイント】車やトラックの総称。vehicles（乗り物、車両）。2019年にも出題された重要語。【紛らわしい選択肢】rivals（ライバル）。,,,,,,,,,,,,,,,,
284,2021-3,The fast-food restaurant ( ) with extra-large drinks because only a few customers ordered them.,did away,kept on,went in,got on,句動詞・廃止する,そのファストフード店は、注文する客が少なかったので特大ドリンクを廃止しました。,【正解のポイント】なくす。did away (with)（廃止した）。頻出のdo away with。【紛らわしい選択肢】kept on（続けた）。,,,,,,,,,,,,,,,,
