ID,出典,問題文,正解,誤答1,誤答2,誤答3,意味・分類タグ,文意訳（ヒント）,解説,,,,,,,,,,,,,,,,
111,2019-1,Andy’s house is far from his office. It takes him more than an hour to ( ) to work every morning.,commute,appeal,behave,qualify,動詞・通勤する,アンディの家は会社から遠いです。毎朝通勤するのに1時間以上かかります。,【正解のポイント】職場へ行くこと。commute（通勤・通学する）。【紛らわしい選択肢】qualify（資格を得る）は準1級重要語。,,,,,,,,,,,,,,,,
112,2019-1,"It should be at least 5 pages, but don’t make it too long. The ( ) is 10 pages.",maximum,market,incident,instrument,名詞・最大,少なくとも5ページであるべきですが、長くしすぎないでください。最大で10ページです。,【正解のポイント】上限の設定。maximum（最大、極限）。対義語はminimum。【紛らわしい選択肢】incident（出来事、事件）。,,,,,,,,,,,,,,,,
113,2019-1,The soccer coach lost his temper during the match and started ( ) at the referees.,yelling,grasping,sneezing,wiping,動詞・叫ぶ,サッカーのコーチは試合中に腹を立て、審判に向かって怒鳴り始めました。,【正解のポイント】lost his temper（キレた）後の行動。yelling（大声で叫ぶ、怒鳴る）。【紛らわしい選択肢】grasping（つかむ、理解する）は抽象的な文脈でも出ます。,,,,,,,,,,,,,,,,
114,2019-1,The government is planning to ( ) a new tax on cars that use a lot of gasoline.,impose,twist,civilize,murder,動詞・課す,政府は、ガソリンを多く使う車に新しい税金を課すことを計画しています。,【正解のポイント】税金や罰金を課す。impose（課す、押し付ける）。準1級・1級でも頻出の硬い表現です。【紛らわしい選択肢】civilize（文明化する）。,,,,,,,,,,,,,,,,
115,2019-1,"Yes, but it’s only ( ). Her new apartment will be ready in a few weeks.",temporary,brilliant,entire,portable,形容詞・一時的な,ええ、でもそれは一時的なものよ。彼女の新しいアパートは数週間で準備できるわ。,【正解のポイント】数週間だけの仮住まい。temporary（一時的な）。対義語permanent（永続的な）とセットで暗記。【紛らわしい選択肢】entire（全体の）。,,,,,,,,,,,,,,,,
116,2019-1,"The new healthcare law was debated in ( ) for days, but in the end the politicians could not agree on it.",parliament,orchestra,foundation,nursery,名詞・議会,新しい医療法は議会で何日も議論されましたが、結局、政治家たちは合意できませんでした。,【正解のポイント】政治家が法を議論する場所。parliament（議会、国会）。【紛らわしい選択肢】foundation（基礎、財団）。,,,,,,,,,,,,,,,,
117,2019-1,She was surprised when Max came in first ( ).,place,part,glance,aid,熟語・順位,彼女はマックス（犬）が1位になったとき驚きました。,【正解のポイント】come in first place（1位になる）。placeは順位を表します。【紛らわしい選択肢】glance（ちらっと見ること）。,,,,,,,,,,,,,,,,
118,2019-1,It must have taken a great ( ) of time to choose all the photos.,deal,base,force,role,熟語・多量,全ての写真を選ぶのには多大な時間がかかったに違いありません。,【正解のポイント】a great deal of（多量の～）。muchの強調表現。【紛らわしい選択肢】play a role（役割を果たす）などのコロケーションと混同しないように。,,,,,,,,,,,,,,,,
119,2019-1,It is becoming popular all over the world because it has developed software ( ) speeding up any business.,capable of,bitter about,sorry for,free from,熟語・能力がある,どんなビジネスもスピードアップできる（能力がある）ソフトウェアを開発したので、世界中で人気が出ています。,【正解のポイント】be capable of ～ing（～する能力がある、～できる）。canのフォーマル表現。【紛らわしい選択肢】free from（～がない）は食品や免税の文脈で出ます。,,,,,,,,,,,,,,,,
120,2019-1,"Tom, have you become ( ) with the new manager yet?",acquainted,superior,knowledgeable,mindful,熟語・知り合い,トム、新しいマネージャーともう知り合いになった？,【正解のポイント】become acquainted with（～と知り合いになる）。knowより堅い表現。【紛らわしい選択肢】superior（優れた・上司）、knowledgeable（知識が豊富な）。,,,,,,,,,,,,,,,,
121,2019-1,"While Simon was on vacation, he became sick ( ) eating too much food.",from,to,at,on,熟語・～が原因で,サイモンは休暇中、食べ過ぎが原因で具合が悪くなりました。,【正解のポイント】病気や疲れの原因を表す前置詞from（～から）。sick from eating...。【紛らわしい選択肢】on vacation（休暇中）などのonに釣られないように。,,,,,,,,,,,,,,,,
122,2019-1,"Did my explanation of the new project ( ), Carter?",make sense,stand still,take care,pay attention,熟語・理解できる,私の新しいプロジェクトの説明は意味が通じましたか（理解できましたか）、カーター？,【正解のポイント】make sense（意味をなす、理解できる）。Does it make sense?は確認の定番フレーズ。【紛らわしい選択肢】stand still（じっとしている）。,,,,,,,,,,,,,,,,
123,2019-1,"After all his hard work, Steven felt that he was ( ) a pay raise.",entitled to,related to,stuck in,absorbed in,熟語・権利がある,一生懸命働いたので、スティーブンは自分には昇給の資格があると感じました。,【正解のポイント】be entitled to（～の権利がある、資格がある）。title（権利・肩書き）を与えるイメージ。準1級重要熟語。【紛らわしい選択肢】absorbed in（～に夢中になっている）。,,,,,,,,,,,,,,,,
124,2019-1,( ) who did not have receipts were unhappy.,Those,This,That,These,文法・人々,レシートを持っていない人々は不満でした。,【正解のポイント】Those who...（～する人々）。People who...の堅い言い換え。【紛らわしい選択肢】単数形や他の指示代名詞は文法的に不可。,,,,,,,,,,,,,,,,
125,2019-1,"Well, ( ) that you had a child, how would you feel?",suppose,wish,except,so,文法・もし～なら,もしあなたに子供がいたとしたら、どう感じますか？,【正解のポイント】Suppose (that)...（もし～だとしたら）。Ifの代用となる命令法。【紛らわしい選択肢】wishは仮定法過去（I wish I had...）で使うが、文頭の接続詞的用法ではない。,,,,,,,,,,,,,,,,
126,2019-1,"Now, she can run 5 kilometers in half ( ) that it used to take her.",the time,times,of time,timing,文法・倍数表現,今では、彼女は以前かかっていた半分の時間で5キロ走れます。,【正解のポイント】half the time（半分の時間）。倍数表現（half the size/twice the price）の語順。【紛らわしい選択肢】of timeなど前置詞を入れる必要はありません。,,,,,,,,,,,,,,,,
127,2019-1,"However, unlike normal fossils, which are hard and usually found in rock, amber is able to ( ) soft materials, too.",preserve,buy,create,study,長文語彙・保存する,しかし、硬くて通常岩の中で見つかる通常の化石とは異なり、琥珀は柔らかい物質も保存することができます。,【正解のポイント】長文（The Mysteries of Amber）より。状態を保つこと。preserve（保存する）。2017年にも出ていますが、重要なので再掲。【紛らわしい選択肢】選択肢は文脈に合わない動詞。,,,,,,,,,,,,,,,,
128,2019-2,The restaurant decided to close because of many ( ).,factors,suburbs,vehicles,units,名詞・要因,そのレストランは多くの要因のために閉店することに決めました。,【正解のポイント】原因となる要素。factor（要因）。準1級の長文読解や英作文（causes and effects）で多用されます。【紛らわしい選択肢】suburbs（郊外）。,,,,,,,,,,,,,,,,
129,2019-2,There are instructions on the envelope that tell people not to ( ) the envelope so they do not damage the card.,bend,raise,trap,deal,動詞・曲げる,封筒には、カードを傷つけないように封筒を曲げないでくださいという指示があります。,【正解のポイント】物理的に曲げること。bend。【紛らわしい選択肢】trap（罠にかける、閉じ込める）。,,,,,,,,,,,,,,,,
130,2019-2,Brandon ( ) to a local photography club.,belongs,informs,figures,repeats,動詞・所属する,ブランドンは地元の写真クラブに所属しています。,【正解のポイント】belong to（～に所属している）。【紛らわしい選択肢】inform（知らせる）。,,,,,,,,,,,,,,,,
131,2019-2,Mr. Johnson studied karate for many years and ( ) became the karate teacher.,eventually,slightly,mildly,heavily,副詞・ついに,ジョンソン氏は長年空手を学び、ついに（最終的に）空手の先生になりました。,【正解のポイント】時間が経過した結果。eventually（結局は、ついに）。finallyと近いが、過程の長さを強調するニュアンス。【紛らわしい選択肢】slightly（わずかに）、mildly（穏やかに）。,,,,,,,,,,,,,,,,
132,2019-2,"However, one ( ) is that he often hits his head on low doorways.",disadvantage,ingredient,technique,foundation,名詞・欠点,しかし、一つの欠点は、低い戸口でよく頭をぶつけることです。,【正解のポイント】背が高いことの悪い点。disadvantage（不利な点、欠点）。pros and cons（良い点と悪い点）の文脈で必須。【紛らわしい選択肢】ingredient（材料、成分）。,,,,,,,,,,,,,,,,
133,2019-2,"After watching the Olympic marathon, Karen was ( ) to start jogging.",inspired,created,astonished,disturbed,動詞・触発される,オリンピックのマラソンを見て、カレンはジョギングを始める気になりました（触発されました）。,【正解のポイント】何かを見てやる気をもらうこと。inspire（鼓舞する、着想を与える）。【紛らわしい選択肢】astonished（ひどく驚いた）、disturbed（邪魔した、不安にさせた）。,,,,,,,,,,,,,,,,
134,2019-2,"Last week, she decided to take part in an art ( ) at her school.",competition,definition,expectation,revolution,名詞・コンテスト,先週、彼女は学校の美術コンクールに参加することに決めました。,【正解のポイント】順位を競うもの。competition（競争、試合）。compete（競う）の名詞形。【紛らわしい選択肢】definition（定義）、revolution（革命）。,,,,,,,,,,,,,,,,
135,2019-2,The Queen’s Forest Golf Club is very ( ). It only accepts 20 new members each year.,exclusive,portable,vital,embarrassed,形容詞・排他的な,クイーンズ・フォレスト・ゴルフクラブは非常に高級（排他的）です。毎年20人の新会員しか受け入れません。,【正解のポイント】限られた人しか入れない。exclusive（排他的な、高級な、独占的な）。準1級・1級レベルの形容詞ですが2級で正解になります。【紛らわしい選択肢】vital（極めて重要な）、embarrassed（恥ずかしい）。,,,,,,,,,,,,,,,,
136,2019-2,"When the woman saw a car accident last night, she immediately called an ( ).",ambulance,accomplishment,occasion,objection,名詞・救急車,昨夜交通事故を見たとき、女性はすぐに救急車を呼びました。,【正解のポイント】事故の対応。ambulance（救急車）。【紛らわしい選択肢】accomplishment（達成）、objection（異議）。,,,,,,,,,,,,,,,,
137,2019-2,Greg was pleased when his school ( ) with its uniform. He prefers wearing casual clothes to school.,did away,caught up,got away,kept up,句動詞・廃止する,グレッグは学校が制服を廃止したとき喜びました。,【正解のポイント】制服をなくす。do away with（廃止する）。2017年にも出題された超頻出熟語です。【紛らわしい選択肢】catch up (with)（追いつく）。,,,,,,,,,,,,,,,,
138,2019-2,"Who do you ( ), your mother or your father? - I look like my father.",take after,read through,look through,go after,句動詞・似ている,お父さんとお母さん、どっちに似てる？ - 父に似ています。,【正解のポイント】親に似る。take after（（血縁者に）似ている）。resembleの口語。【紛らわしい選択肢】go after（追いかける）。,,,,,,,,,,,,,,,,
139,2019-2,She is anxious ( ) being away from her family for such a long time.,about,on,by,below,熟語・心配している,彼女はそんなに長い間家族と離れることを心配しています。,【正解のポイント】be anxious about（～を心配している）。be anxious for（～を切望している）との違いに注意。,,,,,,,,,,,,,,,,
140,2019-2,They’re just a little present to ( ) for canceling our date last week.,make up,sign up,go out,come out,句動詞・埋め合わせる,先週のデートをキャンセルした埋め合わせをするためのちょっとしたプレゼントよ。,【正解のポイント】make up for（～の埋め合わせをする、償う）。compensate forの口語。【紛らわしい選択肢】sign up（登録する）。,,,,,,,,,,,,,,,,
141,2019-2,Mr. Smith told his students to organize their reports ( ): they must begin with...,as follows,by nature,in stock,off duty,熟語・次の通り,スミス先生は生徒たちにレポートを次のようにまとめるよう言いました。,【正解のポイント】具体例を列挙する前の導入。as follows（次の通り）。【紛らわしい選択肢】by nature（生まれつき）、in stock（在庫がある）。,,,,,,,,,,,,,,,,
142,2019-2,"I did, but I went ( ) and secretly gave the customers a discount.",behind his back,in his favor,at his feet,to his joy,熟語・隠れて,そうだけど、彼（上司）のいないところでこっそり客に割引をしたんだ。,【正解のポイント】behind someone's back（人のいないところで、陰で）。【紛らわしい選択肢】in his favor（彼に有利に）。,,,,,,,,,,,,,,,,
143,2019-2,He has become ( ) it over the last year.,accustomed to,relevant to,guilty of,worthy of,熟語・慣れる,彼はここ一年でそれに慣れました。,【正解のポイント】be accustomed to（～に慣れている）。【紛らわしい選択肢】relevant to（～に関連がある）は準1級必須。,,,,,,,,,,,,,,,,
144,2019-2,"Having ( ) his cup of coffee, Harry paid his bill and left the café.",finished,finish,been finished,finishing,文法・完了分詞構文,コーヒーを飲み終えて、ハリーは勘定を払ってカフェを出ました。,【正解のポイント】Having + 過去分詞（～したので、～した後で）。主節より前の時間を表す分詞構文。【紛らわしい選択肢】finishing（単純な分詞構文）だと同時進行になるため不自然。,,,,,,,,,,,,,,,,
145,2019-2,"Oh, there is ( ) left. We’ll have to buy some.",none,not more,no one,any more,文法・代名詞,ああ、一つも残っていないよ。買わなきゃ。,【正解のポイント】何も無いこと（数量）。none（何も～ない）。no milkの代わり。【紛らわしい選択肢】no oneは人を指す。,,,,,,,,,,,,,,,,
146,2019-2,Water is to fish ( ) land is to humans.,what,which,than,for,文法・関係代名詞,魚にとっての水は、人間にとっての陸と同じである。,【正解のポイント】A is to B what C is to D（AのBに対する関係はCのDに対する関係と同じだ）。定型構文です。,,,,,,,,,,,,,,,,
147,2019-2,"Although it is more expensive, many musicians believe it ( ) to know their instruments are safe.",is worth the price,is a poor way,increases their concerts,reduces costs,長文語彙・価値がある,高額ですが、多くのミュージシャンは楽器が安全だと知ることにはその価格の価値があると考えています。,【正解のポイント】長文（Trouble with Transporting）より。worth the price（価格に見合う価値がある）。worth ～ing（～する価値がある）も重要。,,,,,,,,,,,,,,,,
148,2019-2,"This suggests that cities do not need to get rid of slums. Instead, slums can ( ).",be a good thing,make business worse,clean up,result in crime,長文語彙・スラムの変化,これは、都市がスラムを排除する必要がないことを示唆しています。その代わり、スラムは良いものになり得るのです。,【正解のポイント】長文（Changing Slums）より。文脈理解。スラムの住民がビジネスを生み出し経済に貢献するというポジティブな文脈。,,,,,,,,,,,,,,,,
149,2019-3,Rick decided to quit his job because the pay was not ( ).,adequate,obvious,ridiculous,intensive,形容詞・十分な,リックは給料が十分でなかったので仕事を辞めることにしました。,【正解のポイント】生活するには足りない。adequate（十分な、適切な）。sufficientと同義。準1級合格には必須の語彙です。【紛らわしい選択肢】intensive（集中的な）、ridiculous（ばかげた）。,,,,,,,,,,,,,,,,
150,2019-3,"Until last year, the school chess tournament was held ( )... Now, the tournament is held twice a year.",annually,innocently,visually,objectively,副詞・毎年,昨年まで、学校のチェス大会は年に一度開催されていました。,【正解のポイント】頻度。annually（年に一度）。yearlyと同じ。【紛らわしい選択肢】objectively（客観的に）。,,,,,,,,,,,,,,,,
151,2019-3,"Many different kinds of ( ), from motorbikes to huge trucks, took part in the New Year’s parade.",vehicles,liquids,barriers,thermometers,名詞・乗り物,バイクから巨大なトラックまで、様々な種類の乗り物がパレードに参加しました。,【正解のポイント】移動手段の総称。vehicles（乗り物、車両）。【紛らわしい選択肢】barriers（障壁）、thermometers（温度計）。,,,,,,,,,,,,,,,,
152,2019-3,The actor got so many messages from fans that he could not ( ) to all of them himself.,respond,confess,drag,frown,動詞・返信する,俳優はファンからあまりに多くのメッセージをもらったので、自分ですべてに返信することができませんでした。,【正解のポイント】メッセージへの反応。respond (to)（～に返答する、反応する）。replyより堅い語。【紛らわしい選択肢】confess（自白する）、frown（眉をひそめる）。,,,,,,,,,,,,,,,,
153,2019-3,Beethoven was a famous composer and musician who created several ( ).,masterpieces,debts,proposals,traps,名詞・傑作,ベートーベンはいくつかの傑作を生み出した有名な作曲家でした。,【正解のポイント】最高の音楽作品。masterpieces（傑作、名作）。【紛らわしい選択肢】debts（借金）、proposals（提案）。,,,,,,,,,,,,,,,,
154,2019-3,"Richard Wilson is now a successful businessman, but he grew up in ( ).",poverty,accuracy,quantity,curiosity,名詞・貧困,リチャード・ウィルソンは今では成功したビジネスマンですが、貧困の中で育ちました。,【正解のポイント】お金がない状態。poverty（貧困）。poorの名詞形。【紛らわしい選択肢】accuracy（正確さ）、curiosity（好奇心）。,,,,,,,,,,,,,,,,
155,2019-3,"During the movie, she was so scared that she began to ( ).",tremble,commit,migrate,insist,動詞・震える,映画の間、彼女はとても怖くて震え始めました。,【正解のポイント】恐怖で体が揺れる。tremble（震える）。【紛らわしい選択肢】commit（（罪を）犯す・委ねる）、migrate（移住する）。,,,,,,,,,,,,,,,,
156,2019-3,"Ben could not ( ) the noise anymore, so he decided to move to another apartment.",tolerate,stimulate,disturb,inform,動詞・許容する,ベンはもう騒音に我慢できなかったので、別のアパートに引っ越すことにしました。,"【正解のポイント】嫌なことに耐える。tolerate（許容する、我慢する）。put up with, stand, bearの言い換えとして準1級最頻出語の一つです。【紛らわしい選択肢】stimulate（刺激する）。",,,,,,,,,,,,,,,,
157,2019-3,Sally had ( ) that she would have to pay about $80 for electricity in July.,estimated,accompanied,constructed,stretched,動詞・見積もる,サリーは7月の電気代が約80ドルになると見積もっていました。,【正解のポイント】金額を予測する。estimated（見積もった、推定した）。【紛らわしい選択肢】constructed（建設した）。,,,,,,,,,,,,,,,,
158,2019-3,"He has a small ( ), so he will travel by bicycle and stay in cheap hotels.",budget,scar,flame,label,名詞・予算,彼は予算が少ないので、自転車で旅行し、安いホテルに泊まるつもりです。,【正解のポイント】使えるお金の計画。budget（予算）。on a budget（低予算で）も頻出。【紛らわしい選択肢】scar（傷跡）。,,,,,,,,,,,,,,,,
159,2019-3,"The girl begged her parents to let her go to the pop concert, but it was in ( ).",vain,trouble,love,mind,熟語・無駄に,少女はポップコンサートに行かせてくれるよう両親に懇願しましたが、無駄でした。,【正解のポイント】in vain（無駄に）。努力が実らないこと。【紛らわしい選択肢】in trouble（困って）。,,,,,,,,,,,,,,,,
160,2019-3,The reporter spent all day sitting in the courtroom ( ) what everyone said in his notebook.,taking down,giving in,booking into,coming across,句動詞・書き留める,記者は一日中法廷に座り、皆が言ったことをノートに書き留めていました。,【正解のポイント】記録する。taking down（書き留める）。write downと同じ。【紛らわしい選択肢】giving in（屈服する）、coming across（偶然出会う）。,,,,,,,,,,,,,,,,
161,2019-3,"No, I have to go ( ) of Singapore.",by way,in charge,for fear,on behalf,熟語・経由で,いいえ、シンガポール経由で行かなければなりません。,【正解のポイント】by way of（～経由で）。viaと同じ。【紛らわしい選択肢】in charge of（～を担当して）、on behalf of（～を代表して）。,,,,,,,,,,,,,,,,
162,2019-3,"( ) of cost, it was very expensive, but people think it was necessary.",In terms,In place,By means,On top,熟語・～の点では,費用の点では非常に高額でしたが、人々はそれが必要だったと考えています。,【正解のポイント】In terms of（～の点では、～に関しては）。準1級・1級の長文・リスニング・英作文すべてで使える万能熟語です。【紛らわしい選択肢】By means of（～という手段で）。,,,,,,,,,,,,,,,,
163,2019-3,"When you get to Redville, how will you ( ) to the hotel from the bus station?",find your way,change your mind,keep your word,raise your hand,熟語・たどり着く,レッドビルに着いたら、バス停からホテルまでどうやってたどり着く（道を見つける）のですか？,【正解のポイント】道順を知る。find one's way（たどり着く、道を見つける）。【紛らわしい選択肢】change one's mind（気が変わる）。,,,,,,,,,,,,,,,,
164,2019-3,He did poorly in his classes ( ) effort.,for lack of,in time for,in danger of,of service to,熟語・～不足で,彼は努力不足のために、授業の成績が悪かったです。,【正解のポイント】for lack of（～が不足して）。lack（欠乏）は名詞・動詞両方で重要。【紛らわしい選択肢】in danger of（～の危険があって）。,,,,,,,,,,,,,,,,
165,2019-3,"Oh, I’ve been ( ) at a gym three times a week.",working out,keeping up,standing up,giving out,句動詞・運動する,ああ、週に3回ジムで運動しているんだ。,【正解のポイント】ジムで鍛えること。working out（運動する、筋トレする）。solve（解決する）の意味もあります。【紛らわしい選択肢】giving out（配る）。,,,,,,,,,,,,,,,,
166,2019-3,The art teacher decorated the walls of her classroom with pictures ( ) by her students.,drawn,drawing,draw,have drawn,文法・過去分詞,美術の先生は、教室の壁を生徒によって描かれた絵で飾りました。,【正解のポイント】pictures (which were) drawn by... という受動の関係。drawn（描かれた）。【紛らわしい選択肢】drawing（描いている）だと「絵が何かを描いている」ことになり不自然。,,,,,,,,,,,,,,,,
